{
  "audit_head_sha256": "19ee452e53782dd65ddbb125ede7aed4d0de739c3d1f991751e2c3ca6a1c380e",
  "condition_code": "BENCHMARK_ALIGNED",
  "ended_at_epoch_ms": 1788434269253,
  "files": [
    {
      "bytes": 676,
      "path": "anchors.jsonl",
      "sha256": "1b4b0510d9f935b2246972150051ed4d4275bf05119f072ccbdea7c4dd6e7651"
    },
    {
      "bytes": 18082,
      "path": "audit.jsonl",
      "sha256": "7d8cc3217fc9de4c5501841e4f6de59661520255596bb26d4e937ca0a30f20c1"
    },
    {
      "bytes": 370,
      "path": "captures.jsonl",
      "sha256": "a6bd5dd9266891cc38e274fbe71213ea0211ec4267fa33e48aa1d439cf08a540"
    },
    {
      "bytes": 258,
      "path": "context_events.jsonl",
      "sha256": "6cd056d3030b8ff12396cd91e0f9160179877a14937257476cbd96d9b07174c3"
    },
    {
      "bytes": 427,
      "path": "decisions.jsonl",
      "sha256": "6f2b4aa5d320836491470d0c5906d4511cdcccb4151b2b351a8acf0c5766dfca"
    },
    {
      "bytes": 242,
      "path": "deliveries.jsonl",
      "sha256": "46686772a0573244bba0f3a9a07f0033721408bd863b35c15747687474ceb57a"
    },
    {
      "bytes": 113,
      "path": "episodes.jsonl",
      "sha256": "03d62d066cbf09fcc53380a6caf5461e21aa366d44ef3aff6d0a89beb362b7a7"
    },
    {
      "bytes": 23737,
      "path": "images/capture-a6518762-5741-4fd3-885c-cb940c8c1398.jpg",
      "sha256": "489ea6dbfba0325414d4e6b35144428215aa7981cc1005d689f3801772d54c41"
    },
    {
      "bytes": 1265,
      "path": "inference_requests.jsonl",
      "sha256": "d57c48f973e20221c69c3f2be3f195070c334e5f67f4d5b97b436b3687f68b35"
    },
    {
      "bytes": 889,
      "path": "observations.jsonl",
      "sha256": "60bbc5085040c764e1321521ac1f50b4792f19785745bb2ea3c3aa09fcdaa553"
    },
    {
      "bytes": 0,
      "path": "packets.jsonl",
      "sha256": "e3b0c44298fc1c149afbf4c8996fb92427ae41e4649b934ca495991b7852b855"
    },
    {
      "bytes": 1679,
      "path": "raw_responses.jsonl",
      "sha256": "f8805b30cdb844ca647e340793d49fc6e708cacbc0a6d709a1f815486460f939"
    },
    {
      "bytes": 0,
      "path": "receipts.jsonl",
      "sha256": "e3b0c44298fc1c149afbf4c8996fb92427ae41e4649b934ca495991b7852b855"
    },
    {
      "bytes": 4288,
      "path": "runtime_events.jsonl",
      "sha256": "4af8ca8861f422c3158198035bb9afb58cee4ce510f86f119826864c1da6830b"
    },
    {
      "bytes": 326,
      "path": "sensor_windows.jsonl",
      "sha256": "f79543cc436833c8edfd8c87e3e1fe27f963d70b1dab1ba68d28333947e36f38"
    },
    {
      "bytes": 0,
      "path": "user_feedback.jsonl",
      "sha256": "e3b0c44298fc1c149afbf4c8996fb92427ae41e4649b934ca495991b7852b855"
    }
  ],
  "frozen": {
    "contract": {
      "mock": false,
      "mock_mode": null,
      "model_config": {
        "config_sha256": "ba8118c134fbb8c58f7c4a33c4a11065ef8bcd1b0935eda16b122615830bd169",
        "connection_mode": "DIRECT_API_KEY",
        "decision_ttl_ms": 20000,
        "endpoint": "https://dashscope.aliyuncs.com/compatible-mode/v1/chat/completions",
        "model_id": "qwen3.7-flash-2026-07-15",
        "parameters": {
          "enable_thinking": false,
          "max_output_tokens": 512,
          "seed": 20260824,
          "temperature": 0.0,
          "top_p": 1.0
        },
        "response_language": "zh-CN",
        "timeout_ms": 15000,
        "wire_api": "chat_completions"
      },
      "model_id": "qwen3.7-flash-2026-07-15",
      "not_for_paper": true,
      "parser_hash": "d8640f0f8220262adfd79dcf6864d689799d3ebd5da0ff31aca3a5bfc456c668",
      "preprocess_hash": "de9f82dbfc6975ca045418003cf80a60a2b05e40eeeb2c8689ddbe7121f6eba7",
      "prompt_hash": "10df36e6c4559e70b05b71e549f9e44e0b1159439edd2256bd40374310903ee8",
      "protocol_version": "opstate-online-v2",
      "request_schema_sha256": "66ca2fd5145b54392cf0dff807cc8a2575704c7826363df493fcabbb144e4985",
      "response_schema_sha256": "19be82d16972ca122468c00118a2447d1002a1ac19ba45a0f103cd282776429f",
      "strict_contract": true
    },
    "revealed_event_ids": [
      "evt_calendar_meeting"
    ],
    "scenario_asset": "scenarios/meeting-move.json"
  },
  "glasses_app_version": "not_recorded",
  "journal_entries": 17,
  "model_id": "qwen3.7-flash-2026-07-15",
  "parser_sha256": "d8640f0f8220262adfd79dcf6864d689799d3ebd5da0ff31aca3a5bfc456c668",
  "participant_alias": "TEST_DIRECT_API",
  "phone_app_version": "0.5.0-dev",
  "preprocess_sha256": "de9f82dbfc6975ca045418003cf80a60a2b05e40eeeb2c8689ddbe7121f6eba7",
  "prompt_sha256": "10df36e6c4559e70b05b71e549f9e44e0b1159439edd2256bd40374310903ee8",
  "runtime_config_sha256": "ed5af24d4398ac3144f34c764545202cdb367c6d4ec355e07f839d807eb11da7",
  "scenario_id": "meeting_move_phone_v4",
  "schema_version": "opstate_session_export_v2",
  "session_epoch": 1788434267423,
  "session_id": "session-c9cf218a-82b7-4df7-9249-1e3b0bd9799d",
  "started_at_epoch_ms": 1788434267435
}
